Title,URL,Category,Sub-Category,Skills,Rating,Organization
Genomic Data Science Specialization,https://www.coursera.org/specializations/genomic-data-science,Data Science,Data Analysis,"Bioinformatics, Statistics, Data Science, Computational Biology, Biopython, Python Programming, Genomics, Bioinformatics Algorithms, Algorithms, Algorithms On Strings, Samtools, Unix, ",4.4,Coursera
Methods and Statistics in Social Sciences Specialization,https://www.coursera.org/specializations/social-science,Social Sciences,Governance and Society,"Statistics, Statistical Inference, R Programming, Qualitative Research, Confidence Interval, Statistical Hypothesis Testing, Regression Analysis, Analysis Of Variance (ANOVA), ",4.6,Coursera
"NoSQL, Big Data, and Spark Foundations Specialization",https://www.coursera.org/specializations/nosql-big-data-and-spark-foundations,Information Technology,Data Management,"Apache Hadoop, Mongodb, Big Data, Apache Spark, NoSQL Databases, NoSQL, Cloud Database, Cloudant, Cassandra, SparkSQL, SparkML, ",4.3,Coursera
Think like a CFO Specialization,https://www.coursera.org/specializations/thinklikeacfo,Business,Finance,"Financial Accounting, Accounting, Financial Statement, Balance Sheet, Dupont Analysis, Management Accounting, Business Analysis, Finance, Corporate Finance, Financial Risk, Evaluation, Investment, ",4.8,Coursera
TensorFlow: Advanced Techniques Specialization,https://www.coursera.org/specializations/tensorflow-advanced-techniques,Data Science,Machine Learning,"Model Interpretability, Custom Training Loops, Custom and Exotic Models, Generative Machine Learning, Object Detection, Functional API, Custom Layers, Custom and Exotic Models with Functional API, Custom Loss Functions, Distribution Strategies, Basic Tensor Functionality, GradientTape for Optimization, ",4.8,Coursera
"Data Engineering, Big Data, and Machine Learning on GCP Specialization",https://www.coursera.org/specializations/gcp-data-machine-learning,Data Science,Machine Learning,"Tensorflow, Bigquery, Google Cloud Platform, Cloud Computing, ",4.6,Coursera
Mathematics for Machine Learning Specialization,https://www.coursera.org/specializations/mathematics-machine-learning,Data Science,Machine Learning,"Eigenvalues And Eigenvectors, Principal Component Analysis (PCA), Multivariable Calculus, Linear Algebra, Basis (Linear Algebra), Transformation Matrix, Linear Regression, Vector Calculus, Gradient Descent, Dimensionality Reduction, Python Programming, ",4.6,Coursera
Modern and Contemporary Art and Design Specialization,https://www.coursera.org/specializations/modern-contemporary-art-design,Arts and Humanities,Music and Art,"Photography, Design, Art, History, Museums, Creativity, Art History, Art Direction, ",4.8,Coursera
Agile Development Specialization,https://www.coursera.org/specializations/agile-development,Computer Science,Design and Product,"hypothesis-driven development, Design Thinking, User Experience (UX), agile, Lean Startup, agile user stories, User Experience Design (UXD), Agile Software Development, Product Management, Software Development, Usability Testing, Continuous Delivery, ",4.7,Coursera
Career Success Specialization,https://www.coursera.org/specializations/career-success,Business,Business Essentials,"Project Management, Information Technology (IT) Management, Communication, Negotiation, Leadership, Team Management, Task Management, Management, Planning, Plan, Accounting, Financial Ratio, ",4.6,Coursera
U.S. Federal Taxation Specialization,https://www.coursera.org/specializations/united-states-federal-taxation,Business,Business Essentials,"Depreciation, Federal Tax Returns, Tax Law, ",4.8,Coursera
The Business of Music Production Specialization,https://www.coursera.org/specializations/business-music-production,Arts and Humanities,Music and Art,"Copyright, Music production, Contracts, Pro Tools, Music recording, Music business, Revenue streams, Teambuilding, Audio Production, Music, Songwriting, Create music legally, ",4.9,Coursera
The Business of Health Care Specialization,https://www.coursera.org/specializations/healthcare-administration-management,Health,Healthcare Management,"Insurance, Health Economics, ",4.6,Coursera
Practical Data Science on the AWS Cloud Specialization,https://www.coursera.org/specializations/practical-data-science,Data Science,Machine Learning,"Natural Language Processing with BERT, ML Pipelines and ML Operations (MLOps), A/B Testing and Model Deployment, Data Labeling at Scale, Automated Machine Learning (AutoML), Statistical Data Bias Detection, Multi-class Classification with FastText and BlazingText, Data ingestion, Exploratory Data Analysis, ML Pipelines and MLOps, Model Training and Deployment with BERT, Model Debugging and Evaluation, ",4.6,Coursera
Risk Management Specialization,https://www.coursera.org/specializations/risk-management,Business,Finance,"Credit Risk Measurement and Management, Application of Financial Statistics and Probability, Market Risk Measurement and Management, Operational Risk Measurement and Management, Risk Management, Financial Risk, Leadership and Financial Risk Estimation and Management, Regulations, Credit Analysis, Financial Analysis, credit risk, Market Risk Management, ",4.7,Coursera
Music Production Specialization,https://www.coursera.org/specializations/music-production,Arts and Humanities,Music and Art,"Audio Recording, Music, Music production, Sound Design, Audio Editing, Audio Production, Songwriting, Music recording, MIDI, Pro Tools, music editing, Music mixing, ",4.8,Coursera
Google Cloud Database Engineer Specialization,https://www.coursera.org/specializations/google-cloud-database-engineer,Information Technology,Cloud Computing,"Cloud Platforms, Cloud Storage, Google Cloud Platform, Google Compute Engine, Google App Engine (GAE), Cloud Computing, MySQL, cloud sql, SQL Operations, Database (DBMS), Data Management, Postgresql, ",4.7,Coursera
Architecting with Google Compute Engine Specialization,https://www.coursera.org/specializations/gcp-architecture,Information Technology,Cloud Computing,"Google Compute Engine, Google App Engine (GAE), Google Cloud Platform, Cloud Computing, Virtual Machine, Network Architecture, Debugging, Cloud Storage, Data Store, Load Balancing, Virtual Private Network (VPN), Autoscaling, ",4.7,Coursera
Global Procurement and Sourcing Specialization,https://www.coursera.org/specializations/procurement-sourcing,Business,Leadership and Management,"Negotiation, Contracts, ",4.7,Coursera
Entrepreneurship: Growing Your Business Specialization,https://www.coursera.org/specializations/entrepreneurship-growing-your-business,Business,Business Strategy,"Entrepreneurship, Leadership & Management, Innovation, Finance, HR Tech, Financial Accounting, Accounting, Financial Statement, Balance Sheet, Leadership, Business Ethics, Ethical Leadership, ",4.8,Coursera
Six Sigma Yellow Belt Specialization,https://www.coursera.org/specializations/six-sigma-fundamentals,Business,Leadership and Management,"Project Management, Lean Six Sigma, Binomial Distribution, Six Sigma, Process Improvement, Lean Methods, Statistics, Data Analysis, Causality, ",4.7,Coursera
The DIY Musician Specialization,https://www.coursera.org/specializations/diy-musician,Arts and Humanities,Music and Art,"Crowdfunding, Music production, Social Media, Songwriting, Music recording, Music, Poetry, Audio Production, MIDI, Pro Tools, Music business, Marketing, ",4.7,Coursera
Algorithms Specialization,https://www.coursera.org/specializations/algorithms,Computer Science,Algorithms,"Algorithms, Dynamic Programming, Greedy Algorithm, Divide And Conquer Algorithms, Randomized Algorithm, Sorting Algorithm, Graphs, Data Structure, Hash Table, Spanning Tree, Np-Completeness, ",4.8,Coursera
"Influencing: Storytelling, Change Management and Governance Specialization",https://www.coursera.org/specializations/influencing-storytelling-change-management,Business,Leadership and Management,"Change Management, Communication, Negotiation, Risk governance, ",4.7,Coursera
Applied Data Science with R Specialization,https://www.coursera.org/specializations/applied-data-science-r,Data Science,Data Analysis,"Shiny Dashboards, Data Analysis and Modelling, R Programmin Language, Data Visualization (DataViz), SQL & RDBMS, Data Science, R Programming, Select (Sql), Relational Databases (RDBMS), Data Analysis, Statistical Analysis, Linear Regression, ",4.5,Coursera
Geographic Information Systems  (GIS) Specialization,https://www.coursera.org/specializations/gis,Data Science,Data Analysis,"Geographic Information System (GIS), Satellite, Imagery Analysis, Model Building, spatial visualization, Spatial Analysis, Data Analysis, Data Visualization (DataViz), Software, Analytics, Workflow, Data Management, ",4.8,Coursera
Decentralized Finance (DeFi): The Future of Finance Specialization,https://www.coursera.org/specializations/decentralized-finance-duke,Business,Finance,"Cryptography, Smart Contract, Decentralized Protocols, governance, Blockchain Mechanics, Consensus mechanisms, digital signature, Address mechanics, Flash loans, Bonding curves, Set Protocol’s tokenization method, Mechanics of Compound and Aave, ",4.8,Coursera
Project Management & Other Tools for Career Development Specialization,https://www.coursera.org/specializations/project-management-success,Business,Business Essentials,"Project Management, Risk Management, Communication, Negotiation, Project, Planning, Project Planning, Change Control, Change Management, Email Writing, Proofreading, Writing, ",4.7,Coursera
Project Management Principles and Practices Specialization,https://www.coursera.org/specializations/project-management,Business,Business Essentials,"Schedule, Project Management, Risk Management, Budget, Project, Planning, Project Planning, Budget Estimation, Change Control, Change Management, ",4.7,Coursera
Java Programming and Software Engineering Fundamentals Specialization,https://www.coursera.org/specializations/java-programming,Computer Science,Software Development,"HTML, JavaScript, Cascading Style Sheets (CSS), Java Programming, Html5, Algorithms, Problem Solving, String (Computer Science), Data Structure, Cryptography, Hash Table, Programming Principles, ",4.6,Coursera
MATLAB Programming for Engineers and Scientists Specialization,https://www.coursera.org/specializations/matlab-programming-engineers-scientists,Computer Science,Software Development,"Matlab, Data Analysis, Object-Oriented Programming (OOP), Image Processing, Computer Programming, Problem Solving, Programming Language, ",4.8,Coursera
Design Thinking Specialization,https://www.coursera.org/specializations/uva-darden-design-thinking,Business,Leadership and Management,"Creativity, Strategic Thinking, Design Thinking, Innovation Management, Innovation, ",4.8,Coursera
Architecting with Google Kubernetes Engine Specialization,https://www.coursera.org/specializations/architecting-google-kubernetes-engine,Information Technology,Cloud Computing,"Google Compute Engine, Google App Engine (GAE), Google Cloud Platform, Cloud Computing, ",4.7,Coursera
Security in Google Cloud Specialization,https://www.coursera.org/specializations/security-google-cloud-platform,Information Technology,Security,"Google Compute Engine, Google App Engine (GAE), Google Cloud Platform, Cloud Computing, ",4.7,Coursera
Leading People and Teams Specialization,https://www.coursera.org/specializations/leading-teams,Business,Leadership and Management,"Vision Alignment, Talent Management, Goals and Rewards, Motivate Employees, Leadership, goal setting, Communication, Leadership Development, Onboarding, Coaching, Recruitment, Management, ",4.8,Coursera
Coding for Everyone: C and C++ Specialization,https://www.coursera.org/specializations/coding-for-everyone,Computer Science,Software Development,"Algorithms, C Programming, Coding, C++, Computer Programming, Graph Theory, C++11, Graph Algorithms, Standard Template Library, ",4.4,Coursera
Developing Applications with Google Cloud Specialization,https://www.coursera.org/specializations/developing-apps-gcp,Computer Science,Software Development,"Debugging, Google Cloud Platform, Cloud Storage, Application development, Cloud Computing, Google Compute Engine, Google App Engine (GAE), Data Store, Application Programming Interfaces (API), Cloud Functions, Identity Management (IDM), Cloud Endpoints, ",4.7,Coursera
Real-World Product Management Specialization,https://www.coursera.org/specializations/real-world-product-management,Computer Science,Design and Product,"PM Interviewing, Real-World Examples, Product Management, Real-World Assignments, Technology Leadership, Go-to-market Strategy, Product/Market Fit, Tech Leadership, B2B Sales, Monetization Strategy, A/B/n testing, Customer Retention, ",4.5,Coursera
Pricing Strategy Optimization Specialization,https://www.coursera.org/specializations/uva-darden-bcg-pricing-strategy,Business,Marketing,"Cost-Based Pricing, Pricing Strategies, Market-Based Pricing, Customer Value-based Pricing, Strategic Management, Channel and Direct-to-Consumer Pricing, Price Discrimination, Price Elasticity Of Demand, Customer Willingness to Pay, Measuring Customer Preferences, Customer Psychology, Competitor Pricing Models, ",4.8,Coursera
Networking in Google Cloud Specialization,https://www.coursera.org/specializations/networking-google-cloud-platform,Information Technology,Networking,"Google Compute Engine, Google App Engine (GAE), Google Cloud Platform, Cloud Computing, ",4.8,Coursera
Academic English: Writing Specialization,https://www.coursera.org/specializations/academic-english,Social Sciences,Education,"Punctuation, Essay Writing, Academic Writing, Writing, English Grammar, Grammar, Creative Writing, ",4.8,Coursera
Introduction to Cyber Security Specialization,https://www.coursera.org/specializations/intro-cyber-security,Computer Science,Computer Security and Networks,"Cryptography, Cybersecurity, Risk Assessment, Cyber Defense, Cyber Attacks, Information Security (INFOSEC), Denial-Of-Service Attack (DOS), Public-Key Cryptography, ",4.7,Coursera
Business Data Management and Communication Specialization,https://www.coursera.org/specializations/business-data-management-communication,Data Science,Data Analysis,"Asset Management, Business Analytics, Financial Accounting, Data Analysis, Rstudio, Accounting, Accrual, Financial Statement, Cash Flow, Cash Flow Statement, Analytics, Health Care, ",4.9,Coursera
Intellectual Property Law Specialization,https://www.coursera.org/specializations/introduction-intellectual-property,Business,Business Strategy,"Brand Management, Strategic Thinking, Planning, Intellectual Property, Business Strategy, Asset Management, Value Proposition, Copyright, Copyright Protection, Fair Use, Marketing, Strategic Planning, ",4.8,Coursera
The Singer Songwriter Specialization,https://www.coursera.org/specializations/singer-songwriter,Arts and Humanities,Music and Art,"Music production, Ableton, Singing, Songwriting, Guitar, Tablature, Music notation, Guitar scales, Guitar chords, Popular Music, Breathing Techniques, Belting, ",4.8,Coursera
AI for Medicine Specialization,https://www.coursera.org/specializations/ai-for-medicine,Data Science,Machine Learning,"model interpretation, Image Segmentation, natural language extraction, Machine Learning, time-to-event modeling, Deep Learning, model evaluation, Multi-class classification, Random Forest, model tuning, treatment effect estimation, machine learning interpretation, ",4.7,Coursera
Mergers and Acquisitions  Specialization,https://www.coursera.org/specializations/mergersandacquisitions,Business,Finance,"Financial Accounting, Financial Modeling, Mergers And Acquisitions (M&A), Corporate Investments, Accounting, Taxes, Financial Statement, Corporate Accouting, ",4.5,Coursera
Dynamic Public Speaking Specialization,https://www.coursera.org/specializations/public-speaking,Personal Development,Personal Development,"Communication, Presentation, Speech, Public Speaking, Confidence, ",4.8,Coursera
Supply Chain Analytics Specialization,https://www.coursera.org/specializations/supply-chain-analytics,Business,Business Essentials,"Data Analysis, Supply Chain, Business Intelligence, Demand and Supply Planning, job intelligence, Management Consulting, Benchmarking, Competitive Analysis, Model Selection Validation Improvement, Regression Analysis, Demand Planning and Forecasting, Data Visualization (DataViz), ",4.5,Coursera
Six Sigma Black Belt Specialization,https://www.coursera.org/specializations/six-sigma-black-belt,Business,Leadership and Management,"Statistics, Math, ",4.5,Coursera
Strategic Leadership and Management Specialization,https://www.coursera.org/specializations/strategic-leadership,Business,Leadership and Management,"Strategic Management, Negotiation, Leadership, Business Strategy, self-awareness, Ethical decision-making, Defining Leadership, Trust in relationships, Leadership Development, Develop team culture, Navigate growth and change in teams, Create space for DEIB, ",4.8,Coursera
Music Education for Teachers Specialization,https://www.coursera.org/specializations/music-education,Social Sciences,Education,"Music, Music production, Improvisation, Songwriting, Music Education, classroom management, Curriculum Design, Teaching, Learning, Music Performance, Jazz, Jazz Improvisation, ",4.8,Coursera
Project Management Specialization,https://www.coursera.org/specializations/meem-project-management,Business,Leadership and Management,"Engineering management, Agile Management, Risk Management, Stakeholder Communications, Project Management, Resource Management, Business Communication, Team Management, Project Planning, budget management, Servant Leadership, Strategic Management, ",4.7,Coursera
User Experience Research and Design Specialization,https://www.coursera.org/specializations/michiganux,Computer Science,Design and Product,"User Research, Affinity Diagram, human computer interaction, User Experience (UX), User Experience Design (UXD), Adobe Photoshop, ",4.8,Coursera
Good with Words: Writing and Editing Specialization,https://www.coursera.org/specializations/good-with-words,Personal Development,Personal Development,"Persuasion, Creativity, Writing, Time management, Editing, ",4.8,Coursera
Drug Development Product Management Specialization,https://www.coursera.org/specializations/drug-development-product-management,Health,Healthcare Management,"Marketing, Drug Regulations, Drug Discovery, Clinical Trials, Pharmacology, Drug Development, Clinical Development, Pharmacokinetics, Clinical Research, Clinical Trial Design, ",4.7,Coursera
Excel Skills for Data Analytics and Visualization Specialization,https://www.coursera.org/specializations/excel-data-analytics-visualization,Business,Business Essentials,"Data Analysis, Microsoft Excel, Data Visualization (DataViz), Data Cleansing, Big Data, power bi, ",4.8,Coursera
"Food Sustainability, Mindful Eating, and Healthy Cooking Specialization",https://www.coursera.org/specializations/food-sustainability-mindful-eating-healthy-cooking,Health,Nutrition,"mindful eating, sensible shopping, sustainable eating, food mindfulness, Cooking, Devise a customized plan for optimizing your eating patterns., Rebuild your relationship with food by learning to genuinely love the foods that will support your health in the long term., Practice self-compassion with regard to your eating behaviors and food choices., Observe your own unique eating patterns and identify areas of improvement., Practice food mindfulness or mindful eating on a day-to-day basis., How to identify sustainably caught (or farmed) fish and seafood, How to choose more sustainably raised meat and chicken when shopping at the supermarket (if you eat these foods), ",4.8,Coursera
Web Design for Everybody: Basics of Web Development & Coding Specialization,https://www.coursera.org/specializations/web-design,Computer Science,Mobile and Web Development,"Web Development, Cascading Style Sheets (CSS), Html5, JavaScript, Responsive Web Design, Web Design, Web Accessibility, HTML, Style Sheets, Document Object Model (DOM), Bootstrap (Front-End Framework), ",4.8,Coursera
Microsoft Azure Fundamentals AZ-900 Exam Prep Specialization,https://www.coursera.org/specializations/microsoft-azure-fundamentals-az-900,Computer Science,Software Development,"Microsoft Azure, Cloud Computing, Cloud Computing Security, Artificial Intelligence (AI), Internet Of Things (IOT), Application Design, Cloud Governance Strategy, Test Preparation, ",4.6,Coursera
Business Value and Project Management Specialization,https://www.coursera.org/specializations/business-value-project-management,Business,Leadership and Management,"Organizational Structure, Project Execution, Financial Accounting, Strategic Management, Project Management, Accounting, Accrual, Financial Statement, Cash Flow, Cash Flow Statement, Knowledge of General Business Functions, Organization Design, ",4.8,Coursera
Clinical Trials Operations Specialization,https://www.coursera.org/specializations/clinical-trials-operations,Health,Public Health,"Data Management, Trial Design, Ethics, Clinical Data Management, Data Collection, Clinical Trial Design, Randomization, Masking, Statistical Analysis, Monitoring, Reproducibility, Meta-Analysis, ",4.8,Coursera
Investment Management with Python and Machine Learning Specialization,https://www.coursera.org/specializations/investment-management-python-machine-learning,Business,Finance,"Risk Management, Portfolio construction and analysis, Python programming skills, Implementation of data science techniques in investment decisions, Portfolio Optimization, Programming skills, Managing your own personal invetsments, Investment management knowledge, Computer Science, Expertise in data science, Advanced vizualisation, Basics of consuption-based alternative data, ",4.5,Coursera
Data Analysis with R Specialization,https://www.coursera.org/specializations/statistics,Data Science,Data Analysis,"Statistics, R Programming, Rstudio, Exploratory Data Analysis, Statistical Inference, Statistical Hypothesis Testing, Linear Regression, Regression Analysis, ",4.7,Coursera
Excel to MySQL: Analytic Techniques for Business Specialization,https://www.coursera.org/specializations/excel-mysql,Business,Business Essentials,"Binary Classification, Data Analysis, Tableau Software, SQL, Business Analysis, Business Analytics, Business Process, Microsoft Excel, Linear Regression, Data Visualization (DataViz), Visualization (Computer Graphics), MySQL, ",4.6,Coursera
Bayesian Statistics Specialization,https://www.coursera.org/specializations/bayesian-statistics,Data Science,Probability and Statistics,"Bayesian Statistics, Data Science, R Programming, Data Analysis, Statistics, Bayesian Inference, Gibbs Sampling, Markov Model, Mixture Model, Forecasting, Dynamic Linear Modeling, Time Series, ",4.7,Coursera
Data Science Foundations: Data Structures and Algorithms Specialization,https://www.coursera.org/specializations/boulder-data-structures-algorithms,Computer Science,Algorithms,"Algorithm Design, Python Programming, Data Structure Design, Analysis of Algorithms, Hashtables, Graphs Algorithms, Intractability, ",4.7,Coursera
Biostatistics in Public Health  Specialization,https://www.coursera.org/specializations/biostatistics-public-health,Health,Public Health,"Statistics, Statistical Hypothesis Testing, variability, regression, Normal Distribution, summary measures, binary data, Confidence Interval, p values, sampling, P-Value, Proportional Hazards Model, ",4.8,Coursera
Algorithms for Battery Management Systems Specialization,https://www.coursera.org/specializations/algorithms-for-battery-management-systems,Physical Science and Engineering,Electrical Engineering,"Design equivalent-circuit models for lithium-ion battery cells, Implement state-of-charge estimators for lithium-ion battery cells, Understand how lithium-ion battery cells work and basic requirements of battery-management systems, Implement state-of-health estimators for lithium-ion battery cells, Understand balancing requirements and implement power estimators for lithium-ion battery packs, Understand the requirements of a battery-management system, Understand how lithium-ion battery cells work, How to implement state-of-charge (SOC) estimators for lithium-ion battery cells, H​ow to implement state-of-health (SOH) estimators for lithium-ion battery cells, H​ow to design balancers and power-limits estimators for lithium-ion battery packs, ",4.8,Coursera
"Effective Communication: Writing, Design, and Presentation Specialization",https://www.coursera.org/specializations/effective-business-communication,Business,Business Essentials,"Business Writing, Presentation, Graphic Design, Writing, Grammar, Communication, Graphics, Typography, Public Speaking, Communication Design, ",4.8,Coursera
Financial Management Specialization,https://www.coursera.org/specializations/financial-management,Business,Finance,"Financial Mismanagement, Financial Management, Risk Management, Investment, Financial Aid Management, Financial Accounting, Accounting, Accrual, Financial Statement, Cash Flow, Cash Flow Statement, Stock, ",4.7,Coursera
Game Design: Art and Concepts Specialization,https://www.coursera.org/specializations/game-design,Arts and Humanities,Music and Art,"Interactive Storytelling, Game Design Document, Video Game Design, Game Design, Video Game Development, Gameplay, Level Design, Art, ",4.7,Coursera
Neuroscience and Neuroimaging Specialization,https://www.coursera.org/specializations/computational-neuroscience,Data Science,Data Analysis,"Experiment, Neuroscience, R Programming, Image Processing, Statistics, Statistical Analysis, Statistical Model, Preprocessor, Brain, Neurology, ",4.7,Coursera
