Title,URL,Category,Sub-Category,Skills,Rating,Organization
Electronic Music Production Specialization,https://www.coursera.org/specializations/electronic-music-production,Arts and Humanities,Music and Art,"Audio Production, Audio Recording, Music, Sound Design, Audio Editing, Music Making, File Management, Ableton, MIDI programming, Create an electronic composition, Create custom synthesizer patches, Manipulate preset patches, ",4.8,Coursera
Branding: The Creative Journey Specialization,https://www.coursera.org/specializations/branding-the-creative-journey,Business,Business Strategy,"Creativity, Journalism, Branding, Communication, CX, Advertising, Logo, Brand, Brand Identity, Employment, Leadership, Management, ",4.6,Coursera
Six Sigma Green Belt Specialization,https://www.coursera.org/specializations/six-sigma-green-belt,Business,Business Essentials,"Lean Six Sigma, Process Improvement, Six Sigma Green Belt, Six Sigma, Process Capability, ",4.7,Coursera
Excel/VBA for Creative Problem Solving Specialization,https://www.coursera.org/specializations/excel-vba-creative-problem-solving,Computer Science,Design and Product,"Microsoft Excel Vba, Computer Programming, Problem Solving, Arrays, Debugging, ",4.8,Coursera
Business Statistics and Analysis Specialization,https://www.coursera.org/specializations/business-statistics-analysis,Data Science,Probability and Statistics,"Microsoft Excel, Linear Regression, Statistical Hypothesis Testing, Lookup Table, Data Analysis, Pivot Table, Statistics, Statistical Analysis, Normal Distribution, Poisson Distribution, Log–Log Plot, Interaction (Statistics), ",4.7,Coursera
People and Soft Skills for Professional and Personal Success Specialization,https://www.coursera.org/specializations/people-and-soft-skills-for-professional-success,Personal Development,Personal Development,"Presentation Skills, Communication Skills, Professional Development, People Skills, Soft skills, teamwork, Listening Skills, Communication, Critical Thinking, Creative Skills, Powerpoint Skills, Agility, ",4.7,Coursera
"Songwriting: Writing, Arranging, and Producing Music Specialization",https://www.coursera.org/specializations/songwriting,Arts and Humanities,Music and Art,"Music, arranging, Producing, Songwriting, Music recording, Poetry, Melodic Hooks, Melody, Harmony, Writing, Audio Recording, Music Making, ",4.8,Coursera
Culture-Driven Team Building Specialization,https://www.coursera.org/specializations/team-building,Business,Business Essentials,"Team dynamics, Team Building, Collaboration, Intercultural Communication, Organizational Anthropology, Cultural Learning, Leadership, Organizational Culture, Emotional Intelligence, Team Management, ",4.6,Coursera
Investment Management Specialization,https://www.coursera.org/specializations/investment-management,Business,Finance,"Investment Management, Risk Management, Financial Markets, Finance, Bond Market, Interest Rate, Stock, Portfolio Construction, Investment Style, Cognitive Bias, Investment, Portfolio Theories, ",4.8,Coursera
Object Oriented Programming in Java Specialization,https://www.coursera.org/specializations/object-oriented-programming,Computer Science,Software Development,"Data Structure, Hash Table, Java Programming, Object-Oriented Programming (OOP), Algorithms, Problem Solving, String (Computer Science), Cryptography, Logic Programming, Sorting Algorithm, Trees (Data Structures), Linked List, ",4.6,Coursera
Fundamentals of Accounting  Specialization,https://www.coursera.org/specializations/accounting-fundamentals,Business,Business Essentials,"Income Statement, Cost, Financial Statement, Balance Sheet, Accounting, Accounting Terminology, Financial Ratio, ",4.6,Coursera
Databases for Data Scientists Specialization,https://www.coursera.org/specializations/databases-for-data-scientists,Information Technology,Data Management,"Database (DB) Design, Data Warehousing, NoSQL, database administration, SQL, Database (DBMS), Relational Models, Normalization, Entity–Relationship (E-R) Model, Data Science, Database Application, SQL (Structured Query Language), ",4.7,Coursera
PostgreSQL for Everybody Specialization,https://www.coursera.org/specializations/postgresql-for-everybody,Computer Science,Mobile and Web Development,"Json, Database (DBMS), Natural Language Processing, SQL, ",4.7,Coursera
Medical Terminology Specialization,https://www.coursera.org/specializations/medicalterminology,Health,Basic Science,"Communication, Medical language, Health records, human anatomy, ",4.9,Coursera
Advanced Data Science with IBM Specialization,https://www.coursera.org/specializations/advanced-data-science-ibm,Data Science,Machine Learning,"Data Science, Internet Of Things (IOT), Deep Learning, Apache Spark, Statistics, Machine Learning, Long Short-Term Memory (ISTM), ",4.4,Coursera
Probabilistic Graphical Models  Specialization,https://www.coursera.org/specializations/probabilistic-graphical-models,Data Science,Machine Learning,"Inference, Bayesian Network, Belief Propagation, Graphical Model, Markov Random Field, Gibbs Sampling, Markov Chain Monte Carlo (MCMC), Algorithms, Expectation–Maximization (EM) Algorithm, ",4.6,Coursera
FPGA Design for Embedded Systems Specialization,https://www.coursera.org/specializations/fpga-design,Physical Science and Engineering,Electrical Engineering,"Softcore Processor Design, Writing Code in Verilog, Programmable Logic Design, VHDL Coding, Simulation for Verification, Primality Test, Verilog, Digital Design, Static Timing Analysis, Simulating FPGA Designs, Designing FPGA Logic, Designing Test Benches, ",4.5,Coursera
School Health for Children and Adolescents Specialization,https://www.coursera.org/specializations/school-health-for-children-and-adolescents,Health,Patient Care,"Behavioral Health, School Health, Learning Disabilities, Medical Conditions, Nutrition, ",4.8,Coursera
Statistical Analysis with R for Public Health Specialization,https://www.coursera.org/specializations/statistical-analysis-r-public-health,Health,Public Health,"Statistical Thinking, Survival Analysis, Logistic Regression, Data analysis with R, Linear Regression, Run basic analyses in R, R Programming, Understand common data distributions and types of variables, Formulate a scientific hypothesis, Correlation And Dependence, Understand common ways to choose what predictors go into a regression model, Run and interpret Kaplan-Meier curves in R, ",4.7,Coursera
Music Business  Specialization,https://www.coursera.org/specializations/music-business,Business,Leadership and Management,"Copyright, Music, Social Media, Business, Entrepreneurship, Music business, Revenue streams, Teambuilding, Contracts, Marketing, Crowdfunding, Networking, ",4.8,Coursera
Healthcare IT Support Specialization,https://www.coursera.org/specializations/healthcare-it,Health,Health Informatics,"Technical Support, Customer Support, Health Information Technology, Telemedicine, Electronic Health Records, ",4.8,Coursera
Practical Guide to Trading Specialization,https://www.coursera.org/specializations/financial-instruments-trading-investing,Business,Finance,"Fundamental Analysis, World Markets, Futures, Equities, Options Strategies, Sectors, Mutual Funds, Stocks, Business Cycle, FX Case Study, FX Trading, currency pairs, ",4.4,Coursera
Introduction to Logic and Critical Thinking Specialization,https://www.coursera.org/specializations/logic-critical-thinking-duke,Arts and Humanities,Philosophy,"logic, Critical Thinking, reason, Evaluation, Interpretation, Language, Linguistics, ",4.6,Coursera
Blockchain Specialization,https://www.coursera.org/specializations/blockchain,Computer Science,Software Development,"Smart Contract, Ethereum, Blockchains, Solidity, Cryptography, Bitcoin, Cryptocurrency, Blockchain, Remix IDE, MetaMask client, Decentralized Applications, Truffle IDE, ",4.6,Coursera
Software Design and Architecture Specialization,https://www.coursera.org/specializations/software-design-architecture,Computer Science,Software Development,"Software Architecture, Java, Software Design Pattern, Object-Oriented Programming (OOP), Object-Oriented Design, Object-Oriented Analysis And Design, Unified Modeling Language (UML), Web Service, Microservices, Representational State Transfer (REST), Service-Oriented Architecture, ",4.6,Coursera
Climate Change and Sustainable Investing Specialization,https://www.coursera.org/specializations/climatechangeandsustainableinvesting,Business,Finance,"Understand the various policy approaches involved in the transition to a low carbon economy including in particular ""cap & trade"" carbon markets, Learn to assess how climate change impacts financial portfolios and and how to manage climate risk in equity portfolios, Understand how climate change risks impact corporate decisions and company value, Understand the instruments investment funds and solutions used to finance clean technologies and clean energy, Understanding the evidence for climate change and for its anthropogenic origin, Understand the likely impacts on the real economy of the different courses of actions ahead of us, Evaluate projects on a portfolio basis the economic attractiveness of various abatement projects, Assess critically the economic desirability of different technologically feasible abatement technologies, Understand how climate change risk exposure affects corporate decisions and value, Map the financial risks and opportunities of climate change, Understand the instruments investment funds and solutions to finance clean technologies and clean energy, Assess how climate change impacts financial intermediaries and systemic risks, ",4.7,Coursera
Functional Programming in Scala Specialization,https://www.coursera.org/specializations/scala,Computer Science,Software Development,"Scala Programming, Parallel Computing, Apache Spark, Functional Programming, Recursion, Immutable Data Types, Higher-Order Function, Laziness, Type Class, Referential Transparency, Reactive Programming, Data Structure, ",4.7,Coursera
Microsoft Azure Data Fundamentals DP-900 Exam Prep Specialization,https://www.coursera.org/specializations/microsoft-azure-dp-900-data-fundamentals,Data Science,Data Analysis,"Describe how to work with relational data on Azure, Describe core data concepts, Describe how to work with non-relational data on Azure, Describe an analytics workload on Azure, Microsoft Azure, Data Management, Data Storage, Data Concepts, Database (DBMS), NoSQL, SQL, Relational Data, ",4.7,Coursera
Financial Technology (Fintech) Innovations Specialization,https://www.coursera.org/specializations/financialtechnology,Business,Finance,"Credit Technology, Cryptocurrency, Smart Investing, Blockchain, Payment Systems, processing payments, Payment Processing, payment technology, Value Propositions, decentralization algorithms, consensus algorithms, blockchain as a business solution, ",4.7,Coursera
Business Strategies for A Better World Specialization,https://www.coursera.org/specializations/wharton-global-business-strategy,Business,Leadership and Management,"Social Return On Investment (SROI), Corruption, Social Entrepreneurship, Socially Responsible Investing, Global Financial Crisis, Trend Analysis, Economy, Trading, Strategic Management, ",4.7,Coursera
Machine Learning on Google Cloud Specialization,https://www.coursera.org/specializations/machine-learning-tensorflow-gcp,Data Science,Machine Learning,"Vertex AI, Machine Learning, Feature Engineering, Tensorflow, Cloud Computing, Application Programming Interfaces (API), Inclusive ML, Google Cloud Platform, Bigquery, Data Cleansing, Python Programming, Build Input Data Pipeline, ",4.6,Coursera
Integrative Health and Medicine Specialization,https://www.coursera.org/specializations/integrative-health-and-medicine,Health,Patient Care,"wellbeing, patient-centered care, improved symptom management, integrative medicine, evidence-based practice, Evidence-Based Practices, complementary therapies, integrative nursing, symptom management, healthcare, Stress Management, Pain Management, ",4.8,Coursera
Futures Thinking Specialization,https://www.coursera.org/specializations/futures-thinking,Business,Business Essentials,"Strategic Foresight, Simulation, Scenario Design, Future Forecasting, Foresight, Creativity, Strategic Thinking, Innovation, Leadership, Scenario Development, Strategic Planning, Gaming, ",4.8,Coursera
Finance for Technical Managers Specialization,https://www.coursera.org/specializations/finance-for-technical-managers,Business,Leadership and Management,"Product Cost Analysis, Project valuation, financial statement analysis, Discounted Cash Flow Analysis, Financial Adviser, time value of money, Cost Estimation Techniques, Application to Personal Finances, Project Valuation: NPV IRR and Payback Period, Creating a Compelling Project Business Case, Project Selection Techniques, Risk Management: Scenario and Sensitivity Analysis, ",4.7,Coursera
"TESOL Certificate, Part 2: Teach English Now! Specialization",https://www.coursera.org/specializations/tesol-certificate-2,Language Learning,Learning English,"Teaching, English Language, Lesson Plan, Speech, Plan, ",4.9,Coursera
Introduction to Discrete Mathematics for Computer Science Specialization,https://www.coursera.org/specializations/discrete-mathematics,Computer Science,Algorithms,"Graph Theory, Number Theory, Cryptography, Probability, Mathematical Induction, Proof Theory, Discrete Mathematics, Mathematical Logic, Random Variable, Probability Interpretations, Combinatorics, Modular Exponentiation, ",4.5,Coursera
Core Java Specialization,https://www.coursera.org/specializations/core-java,Computer Science,Software Development,"Computer Programming, Java Programming, Web Development, Java Database Connectivity (JDBC), Java Class Library, Object-Oriented Programming (OOP), Crt0, Recursively Enumerable Set, Java Compiler, Javac, Iterator, Linearity, ",4.6,Coursera
Engineering Project Management Specialization,https://www.coursera.org/specializations/engineering-project-management,Business,Leadership and Management,"Planning, Schedule, Earned Value Management (EVMT), Project Management, Procurement, Project Charter, Project Planning, Risk Management Plan, Project Risk Management, ",4.8,Coursera
Bioinformatics Specialization,https://www.coursera.org/specializations/bioinformatics,Health,Health Informatics,"Whole Genome Sequencing, Viterbi Algorithm, Suffix Tree, Python Programming, Algorithms, Unweighted Pair Group Method with Arithmetic Mean (UPGMA), Bioinformatics, Bioinformatics Algorithms, Dynamic Programming, Graph Theory, ",4.4,Coursera
Cybersecurity Attack and Defense Fundamentals Specialization,https://www.coursera.org/specializations/cybersecurity-attack-and-defense,Computer Science,Computer Security and Networks,"Cyberattacks, Network Defense, Digital Forensics, Cybersecurity, Ethical Hacking, Ethica Hacking, Network Security, Computer Forensics, ",4.6,Coursera
Organizational Leadership Specialization,https://www.coursera.org/specializations/organizational-leadership,Business,Leadership and Management,"Design Leadership, Negotiation, Leadership, Marketing, Team Management, Collaboration, Communication, Innovation, Crisis Management, Communications Management, Advertising, Data Analysis, ",4.7,Coursera
Inspirational Leadership: Leading with Sense Specialization,https://www.coursera.org/specializations/inspirational-leadership,Business,Leadership and Management,"Confidence, Communication, Leadership, Strategic Hr Leadership, Human Resources (HR), ",4.7,Coursera
Photography Basics and Beyond: From Smartphone to DSLR Specialization,https://www.coursera.org/specializations/photography-basics,Arts and Humanities,Music and Art,"Social Media, Photography, Copywriting, Writing, Confidence, History, Creativity, Art, Project, ",4.8,Coursera
Omnichannel Retail Strategy Specialization,https://www.coursera.org/specializations/wharton-retail-strategy,Business,Business Strategy,"Talent Management, Marketing Strategy, Performance Management, Analytics, Digital Supply Chain, ",4.8,Coursera
Renewable Energy Specialization,https://www.coursera.org/specializations/renewable-energy,Physical Science and Engineering,Environmental Science and Sustainability,"Renewable Energy, Solar Energy, Energy Projects, Sustainability, Wind Energy, Energy storage, Renewable Energy Techologies, Electricity systems, Wind Power, Sustainable Energy, Project Execution, Project Operations, ",4.8,Coursera
Become an EMT Specialization,https://www.coursera.org/specializations/become-an-emt,Health,Patient Care,"Emergency Medicine, Emergency Medical Technician, EMT, Trauma, Dentures, Foams, Toe, Decontamination, infant, ingestion, listening, emergency, ",4.8,Coursera
Market Research Specialization,https://www.coursera.org/specializations/market-research,Business,Marketing,"Internality, Qualitative Research, quantitative research, Market Research, Proposal Writing, Research Methods, Product Research, Marketing Intelligence, Sample Collection, Sample Size Determination, Sample Preparation, Focus Group, ",4.5,Coursera
Transforming the Fashion Business Specialization,https://www.coursera.org/specializations/transforming-fashion-business,Business,Business Strategy,"Fashion Design, Fashion Systems, Sustainability, Holistic Product Lifecyle, Retail Management, Systems Thinking, Product Life Cycles, User-Centered Design, Research And Development (R&D), Trend Analysis, ethical design and production, Collaboration, ",4.7,Coursera
"GIS, Mapping, and Spatial Analysis Specialization",https://www.coursera.org/specializations/gis-mapping-spatial-analysis,Data Science,Data Analysis,"Geographic Information System (GIS), Cartography, Esri, Mapping, Spatial Analysis, ",4.9,Coursera
Trading Strategies in Emerging Markets Specialization,https://www.coursera.org/specializations/trading-strategy,Business,Finance,"Trading Strategy, Algorithmic Trading, Financial Ratio, Trading, Cost, Financial Statement, Post-Earnings-Announcement Drift (PEAD), F1 Score, ",4.3,Coursera
Healthcare Law Specialization,https://www.coursera.org/specializations/healthcare-law,Health,Healthcare Management,"Affordable Care Act, Health Law, Health Insurance Portability And Accountability Act (HIPAA), Health Policy, Privacy, Healthcare Management, Health Policy Analysis, Health Insurance, Permanent Placement, Unfair Labor Practices, Legal Liability, Budget Estimation, ",4.8,Coursera
Web Applications for Everybody Specialization,https://www.coursera.org/specializations/web-applications,Computer Science,Mobile and Web Development,"Jquery, web application development, Hypertext Preprocessor (PHP), JavaScript, MySQL, HTML, Cascading Style Sheets (CSS), Phpmyadmin, Relational Database, SQL, Create, Read, Update And Delete, ",4.8,Coursera
Inspired Leadership Specialization,https://www.coursera.org/specializations/inspired-leadership,Business,Leadership and Management,"Emotional Intelligence, Coaching, Appreciative Inquiry, Leadership, Negotiation, Mindfulness, Assertiveness, Communication, Active Listening, Change Management, Positive Psychology, Facilitation, ",4.8,Coursera
Marketing Strategy Specialization,https://www.coursera.org/specializations/marketing-strategy,Business,Marketing,"Marketing Plan, Market Research, Positioning (Marketing), Value Proposition, Consumer Behaviour, Data Analysis, Market Segmentation, Marketing Process, Market Analysis, Planning, Marketing Strategy, ",4.4,Coursera
Health Informatics Specialization,https://www.coursera.org/specializations/health-informatics,Health,Health Informatics,"Data Science, Decision Support System, Health Informatics, Health Care, Informatics, health, Digital Health, Decision Analysis, Information Technology Planning, Strategic Leadership, Knowledge Acquisition, Decision Tree, ",4.4,Coursera
Robotics Specialization,https://www.coursera.org/specializations/robotics,Physical Science and Engineering,Electrical Engineering,"Motion Planning, Particle Filter, Matlab, Robotics, Quadcoper, Automated Planning And Scheduling, A* Search Algorithm, Serial Line Internet Protocol (SLIP), Robot, Computer Vision, Estimation, Random Sample Consensus (Ransac), ",4.3,Coursera
Management Consulting Specialization,https://www.coursera.org/specializations/managementconsulting,Business,Leadership and Management,"Management Consulting, Presentation, Problem Solving, Consulting, Recruiting, Business Case, Business Analytics, Case interview, interviewing, Project Management, Data Analysis, Lean Six Sigma, ",4.8,Coursera
Machine Learning Specialization,https://www.coursera.org/specializations/machine-learning,Data Science,Machine Learning,"Data Clustering Algorithms, Machine Learning, Classification Algorithms, Decision Tree, Python Programming, Machine Learning Concepts, Deep Learning, Linear Regression, Ridge Regression, Lasso (Statistics), Regression Analysis, Logistic Regression, ",4.7,Coursera
Professional Skills for the Workplace Specialization,https://www.coursera.org/specializations/professional-skills-for-the-workplace,Business,Business Essentials,"Emotional Intelligence, Adaptability, Problem Solving, Growth Strategies, Resiliency, Critical Thinking, Decision-Making, Brainstorming, Personal Advertisement, Planning, Resilience, ",4.7,Coursera
Introduction to Computer Science and Programming Specialization,https://www.coursera.org/specializations/introduction-computer-science-programming,Computer Science,Software Development,"Computer Graphics (CG), Problem Solving, Mathematics, JavaScript, Computer Programming, ",4.2,Coursera
C# Programming for Unity Game Development Specialization,https://www.coursera.org/specializations/programming-unity-game-development,Computer Science,Software Development,"Video Game Development, C Sharp (C#) (Programming Language), Unity (User Interface), Game Programming, Crt0, For Loop, Console Applications, Foreach Loop, ",4.7,Coursera
Artificial Intelligence: an Overview Specialization,https://www.coursera.org/specializations/artificial-intelligence-overview,Computer Science,Algorithms,"Artificial Intelligence (AI), Ethical issues of artificial intelligence, Machine Learning, Legal issues of artificial intelligence, ",4.7,Coursera
Embedding Sensors and Motors Specialization,https://www.coursera.org/specializations/embedding-sensors-motors,Physical Science and Engineering,Electrical Engineering,"sensor integration, firmware, motor design, embedded engineering, hardware, Analog hardware, Pressure and force sensors, Sensor architecture, PSoc Programming, Circuit Design, Sensor manufacturing, PID control, ",4.6,Coursera
Expressway to Data Science: Essential Math Specialization,https://www.coursera.org/specializations/expressway-to-data-science-essential-math,Math and Logic,Math and Logic,"Derrivatives, Integrals, Matrix Algebra, Diagonalization, Numerical Analysis, Derivatives, Algebra, Singular Value Decomposition (SVD), root-finding, Partial Derivative, matrix diagonalization, ",4.5,Coursera
Everyday Excel Specialization,https://www.coursera.org/specializations/everyday-excel,Computer Science,Design and Product,"Spreadsheet, Microsoft Excel, Problem Solving, Project, computing, Data Management, Real World, Real-world projects, ",4.7,Coursera
C Programming with Linux Specialization,https://www.coursera.org/specializations/c-programming-linux,Computer Science,Software Development,"Linux, Debugging, Algorithms, Software Engineering, C Programming, Computer Programming, Computer Science, Compiler, computer programs/algorithms, Command-Line Interface, ",4.7,Coursera
Blockchain Revolution in Financial Services Specialization,https://www.coursera.org/specializations/blockchain-financial-services,Computer Science,Computer Security and Networks,"Collaborative Working Environment, Blockchain (Database), Open Collaboration, Access Structure, Object Binding, Alcatel Business Communications, Centurylink, Base Address, ",4.7,Coursera
The Pronunciation of American English Specialization,https://www.coursera.org/specializations/american-english-pronunciation,Language Learning,Learning English,"English Language, Pronunciation, ",4.8,Coursera
Managing Cybersecurity Specialization,https://www.coursera.org/specializations/managing-cybersecurity,Information Technology,Security,"Security Management, Network Security, Risk Management, Security Governance, Computer Security Incident Management, Security vulnerabilities and treatments, Threats to cybersecurity, Cybersecurity terminology, cybersecurity program elements, Cybersecurity planning, Cybersecurity performance measurement, Risk identification, ",4.8,Coursera
Digital Manufacturing & Design Technology  Specialization,https://www.coursera.org/specializations/digital-manufacturing-design-technology,Physical Science and Engineering,Electrical Engineering,"Artificial Intelligence (AI), Digital Design, Manufacturing Engineer, Industry 4.0, ",4.6,Coursera
Epidemiology in Public Health Practice Specialization,https://www.coursera.org/specializations/professional-epidemiology,Health,Public Health,"Outbreak investigation, Public Health Surveillance, visualization, Statistics, Epidemiology, Estimation, Geographic Information System (GIS), Statistical Methods, Data Collection, surveillance, Disease Surveillance, Data Analysis, ",4.7,Coursera
Social Media Marketing Specialization,https://www.coursera.org/specializations/social-media-marketing,Business,Marketing,"Business Planning, Digital Marketing, Social Media Marketing, Influencer Marketing, Analytics, Social Marketing, Social Network, Social Media, Marketing Strategy, Writing, A/B Testing, Budget, ",4.7,Coursera
